{
  "work_id": "wrk_01936b2a7c4e7a1b9f3d2e8c6a5b4d21",
  "version": 1,
  "write_epoch": 1,
  "run_id": "run-7f3a",
  "content_hash": "428627abeb7a89c76be9b2641079b6dedef199ac940a40e10ab8a89a8c9197dc",
  "body": {
    "goal": "Add rate limiting to the public API",
    "relevant_artifacts": [
      "src/api/rate-limit.ts"
    ],
    "git_state": {
      "baseCommit": "c0ffee1234567890abcdef1234567890abcdef12",
      "dirty": 0
    },
    "current_state": "A token bucket per API key is implemented.",
    "decisions": [
      "60 requests per minute per key"
    ]
  },
  "created_at": "2026-09-14T09:50:00Z"
}
